{"componentChunkName":"component---gatsby-lite-template-ts","path":"/customize-gatsby-blog","result":{"pageContext":{"sitePath":"/customize-gatsby-blog","data":{"postPage":{"sourceFilePath":"D:/Projects/rick-love-master/code/blog-content/posts/2020-05-12-customize-gatsby-blog.md","sourceFileContent":"---\r\ntitle: \"Customize Gatsby Blog\"\r\ndate: \"2020-05-12\"\r\npath: \"/customize-gatsby-blog\"\r\nauthor: \"Rick Love\"\r\nexcerpt: \"Remove all the placeholder content and fill your blog with you...\"\r\n---\r\n\r\nRemove all the placeholder content and fill your blog with you.\r\n\r\n## Customize your About Page\r\n\r\n- Open `pages/about.md`\r\n- Write a short bio about yourself as a new software developer\r\n\r\n\r\n### Remove the Placeholder Content\r\n\r\nWe won't delete this yet, so you can look back on it for a reference.\r\n\r\n- Rename `posts/example.md` to `posts/example.md.old`\r\n- Rename `posts/hello.md` to `posts/hello.md.old`\r\n- Rename `pages/showcase.md` to `pages/showcase.md.old`\r\n\r\nLater, when you no longer need a reference, you can delete these files.\r\n\r\n\r\n### Customize the Site Navigation\r\n\r\n- Open `gatsby-config.js`\r\n- Customize the `siteMetadata` near the top of the file\r\n    - Change the title, author, etc.\r\n    - Comment out the showcase and example nave sections\r\n    - Example:\r\n\r\n```javascript\r\n\r\n// ...\r\n  siteMetadata: {\r\n    title: `blog_rick_love`,\r\n    description: `It's about development mostly`,\r\n    copyrights: '2020 Copyright Rick Love',\r\n    author: `Rick Love`,\r\n    logo: {\r\n      src: '',\r\n      alt: '',\r\n    },\r\n    logoText: 'blog_rick_love',\r\n    defaultTheme: 'dark',\r\n    postsPerPage: 5,\r\n    showMenuItems: 2,\r\n    menuMoreText: 'Show more',\r\n    mainMenu: [\r\n      {\r\n        title: 'About',\r\n        path: '/about',\r\n      },\r\n      // {\r\n      //   title: 'Showcase',\r\n      //   path: '/showcase',\r\n      // },\r\n      // {\r\n      //   title: 'Example',\r\n      //   path: '/example',\r\n      // },\r\n    ],\r\n  },\r\n// ...\r\n\r\n```\r\n\r\n### Bonus: Change the Cursor Color\r\n\r\n- Try to figure out how to change the cursor color that is blinking in the top left\r\n- Hint: Its a style\r\n- If you need help, you can always look in the github for my blog and see how I did it.\r\n\r\n\r\n### Commit and Push to Deploy\r\n\r\n- Commit your changes\r\n- Push to Github\r\n- Wait for Netlify to Deploy\r\n- Check Your Site\r\n\r\n\r\n","title":"Customize Gatsby Blog","headers":[{"key":"title","value":"Customize Gatsby Blog"},{"key":"date","value":"2020-05-12"},{"key":"path","value":"/customize-gatsby-blog"},{"key":"author","value":"Rick Love"},{"key":"excerpt","value":"Remove all the placeholder content and fill your blog with you..."}],"body":"\r\n\r\nRemove all the placeholder content and fill your blog with you.\r\n\r\n## Customize your About Page\r\n\r\n- Open `pages/about.md`\r\n- Write a short bio about yourself as a new software developer\r\n\r\n\r\n### Remove the Placeholder Content\r\n\r\nWe won't delete this yet, so you can look back on it for a reference.\r\n\r\n- Rename `posts/example.md` to `posts/example.md.old`\r\n- Rename `posts/hello.md` to `posts/hello.md.old`\r\n- Rename `pages/showcase.md` to `pages/showcase.md.old`\r\n\r\nLater, when you no longer need a reference, you can delete these files.\r\n\r\n\r\n### Customize the Site Navigation\r\n\r\n- Open `gatsby-config.js`\r\n- Customize the `siteMetadata` near the top of the file\r\n    - Change the title, author, etc.\r\n    - Comment out the showcase and example nave sections\r\n    - Example:\r\n\r\n```javascript\r\n\r\n// ...\r\n  siteMetadata: {\r\n    title: `blog_rick_love`,\r\n    description: `It's about development mostly`,\r\n    copyrights: '2020 Copyright Rick Love',\r\n    author: `Rick Love`,\r\n    logo: {\r\n      src: '',\r\n      alt: '',\r\n    },\r\n    logoText: 'blog_rick_love',\r\n    defaultTheme: 'dark',\r\n    postsPerPage: 5,\r\n    showMenuItems: 2,\r\n    menuMoreText: 'Show more',\r\n    mainMenu: [\r\n      {\r\n        title: 'About',\r\n        path: '/about',\r\n      },\r\n      // {\r\n      //   title: 'Showcase',\r\n      //   path: '/showcase',\r\n      // },\r\n      // {\r\n      //   title: 'Example',\r\n      //   path: '/example',\r\n      // },\r\n    ],\r\n  },\r\n// ...\r\n\r\n```\r\n\r\n### Bonus: Change the Cursor Color\r\n\r\n- Try to figure out how to change the cursor color that is blinking in the top left\r\n- Hint: Its a style\r\n- If you need help, you can always look in the github for my blog and see how I did it.\r\n\r\n\r\n### Commit and Push to Deploy\r\n\r\n- Commit your changes\r\n- Push to Github\r\n- Wait for Netlify to Deploy\r\n- Check Your Site\r\n\r\n\r\n","summary":"Remove all the placeholder content and fill your blog with you.\r\n\r\n## Customize your About Page\r\n\r\n- Open `pages/about.md`\r\n- Write a short bio about yourself as a new software developer\r\n\r\n\r\n### Remove the Placeholder Content\r\n\r\nWe won't delete this yet, so you can look back on it for a reference.\r\n\r\n- Rename `posts/example.md` to `posts/example.md.old`\r\n- Rename `posts/hello.md` to `posts/hello.md.old`\n\n...","date":"2020-05-12"}}}},"staticQueryHashes":[]}